{
  "schema_version": "v1",
  "partner_id": "paibyun9",
  "plan": "trial",

  "app_name": "LCM Refund Agent",
  "contact_email": "ops@lcm.example",
  "use_case": "refund/cancel workflow test",

  "callback_url": null,
  "expected_rps": 1,
  "data_sensitivity": "unknown",
  "integration_type": "api",

  "org_name": null,
  "security_contact": null,
  "incident_channel": null,

  "human_escalation": { "enabled": false, "channel": null },

  "rate_limit_overrides": { "rps": null, "burst": null, "daily_quota": null },

  "metadata": { "primary_language": "ko", "primary_industry": null, "notes": null },

  "created_at": "2025-12-29T09:00:00Z",
  "updated_at": "2025-12-29T09:00:00Z",
  "status": "active"
}
