{
  "schema_version": "v1",
  "partner_id": "paibyun9",
  "plan": "pro",
  "app_name": "LCM Pro Sample App",
  "contact_email": "dev@paibyun9.com",
  "use_case": "Refund/cancel agent integration using LCM engine",
  "expected_rps": 5,
  "data_sensitivity": "low",
  "integration_type": "webhook",
  "human_escalation": {
    "enabled": false,
    "channel": "email"
  },
  "rate_limit_overrides": {
    "rps": 10,
    "burst": 20,
    "daily_quota": 5000
  },
  "metadata": {
    "primary_language": "ko",
    "primary_industry": "commerce",
    "notes": "pro pass sample"
  },
  "created_at": "2025-12-29T18:00:00Z",
  "updated_at": "2025-12-29T18:00:00Z",
  "status": "active",
  "callback_url": "https://example.com/lcm/callback"
}
